{"schema_version":"izzi.lenticular-array/1","id":"lenticular-four","output":{"width_mm":25.4,"height_mm":25.4},"lenses_per_inch":59.7,"axis":"horizontal","raster_ppi":600,"integer_grid":false,"phase_mm":0.017,"views":[{"schema_version":"izzi.guilloche-scene/1","scene_id":"lenticular-four-view-0",
    "canvas":{"width":320,"height":320,"background":"#FAFAF7"},
    "content":{"kind":"none","accessible_label":"Native graphic pattern review"},
    "treatment":{"kind":"floral-cycloid","seed":20260928,"floral_group_range":[1,3],"petal_range":[5,11],
      "cycloid_amplitude":0,"density":"experimental"},
    "layout":{"kind":"radial","symmetry_order":6,"center":[160,160],"radius":120,"include_radial_field":false,
      "geometries":[{"id":"form","kind":"lobed_contour","origin":[160,160],"radius":105,"rings":9,"ring_spacing":5,"modes":[{"frequency":3,"amplitude":0.18,"phase":0.000000}]}]},
    "palette":{"colors":["#202B2E"],"stroke_width":0.7,"opacity":1,"blend":"normal"},
    "review":{"profile":"experimental","human_acceptance":"PENDING"}},{"schema_version":"izzi.guilloche-scene/1","scene_id":"lenticular-four-view-1",
    "canvas":{"width":320,"height":320,"background":"#FAFAF7"},
    "content":{"kind":"none","accessible_label":"Native graphic pattern review"},
    "treatment":{"kind":"floral-cycloid","seed":20260928,"floral_group_range":[1,3],"petal_range":[5,11],
      "cycloid_amplitude":0,"density":"experimental"},
    "layout":{"kind":"radial","symmetry_order":6,"center":[160,160],"radius":120,"include_radial_field":false,
      "geometries":[{"id":"form","kind":"lobed_contour","origin":[160,160],"radius":105,"rings":9,"ring_spacing":5,"modes":[{"frequency":4,"amplitude":0.18,"phase":0.600000}]}]},
    "palette":{"colors":["#202B2E"],"stroke_width":0.7,"opacity":1,"blend":"normal"},
    "review":{"profile":"experimental","human_acceptance":"PENDING"}},{"schema_version":"izzi.guilloche-scene/1","scene_id":"lenticular-four-view-2",
    "canvas":{"width":320,"height":320,"background":"#FAFAF7"},
    "content":{"kind":"none","accessible_label":"Native graphic pattern review"},
    "treatment":{"kind":"floral-cycloid","seed":20260928,"floral_group_range":[1,3],"petal_range":[5,11],
      "cycloid_amplitude":0,"density":"experimental"},
    "layout":{"kind":"radial","symmetry_order":6,"center":[160,160],"radius":120,"include_radial_field":false,
      "geometries":[{"id":"form","kind":"lobed_contour","origin":[160,160],"radius":105,"rings":9,"ring_spacing":5,"modes":[{"frequency":5,"amplitude":0.18,"phase":1.200000}]}]},
    "palette":{"colors":["#202B2E"],"stroke_width":0.7,"opacity":1,"blend":"normal"},
    "review":{"profile":"experimental","human_acceptance":"PENDING"}},{"schema_version":"izzi.guilloche-scene/1","scene_id":"lenticular-four-view-3",
    "canvas":{"width":320,"height":320,"background":"#FAFAF7"},
    "content":{"kind":"none","accessible_label":"Native graphic pattern review"},
    "treatment":{"kind":"floral-cycloid","seed":20260928,"floral_group_range":[1,3],"petal_range":[5,11],
      "cycloid_amplitude":0,"density":"experimental"},
    "layout":{"kind":"radial","symmetry_order":6,"center":[160,160],"radius":120,"include_radial_field":false,
      "geometries":[{"id":"form","kind":"lobed_contour","origin":[160,160],"radius":105,"rings":9,"ring_spacing":5,"modes":[{"frequency":6,"amplitude":0.18,"phase":1.800000}]}]},
    "palette":{"colors":["#202B2E"],"stroke_width":0.7,"opacity":1,"blend":"normal"},
    "review":{"profile":"experimental","human_acceptance":"PENDING"}}]}
